{
  "$schema": "../../src/schema/skin-tokens.schema.json",
  "meta": {
    "name": "Mehu Fresh",
    "description": "Fresh, modern, vibrant theme with golden and coral accents, featuring dual typography with Heebo and Raleway fonts",
    "version": "1.0.0",
    "author": "Component Kit System",
    "tags": ["fresh", "modern", "vibrant", "golden", "coral", "restaurant", "contemporary"],
    "preview": "preview.jpg",
    "created": "2025-08-12T10:30:00Z",
    "updated": "2025-08-12T10:30:00Z"
  },
  "colors": {
    "primary": "#d8bc41",
    "primaryHover": "#c2a73a",
    "secondary": "#ff6a6a",
    "accent": "#ffa726",
    "background": "#ffffff",
    "surface": "#fefefe",
    "dark": "#2d2d2d",
    "text": {
      "primary": "#2d2d2d",
      "secondary": "#5a5a5a",
      "muted": "#888888",
      "inverse": "#ffffff",
      "accent": "#ff6a6a"
    },
    "border": {
      "default": "#e8e8e8",
      "light": "#f5f5f5",
      "dark": "#2d2d2d",
      "accent": "#d8bc41"
    },
    "status": {
      "success": "#4caf50",
      "warning": "#ffa726",
      "error": "#f44336",
      "info": "#2196f3"
    },
    "hero": {
      "background": "linear-gradient(135deg, #d8bc41 0%, #ff6a6a 100%)",
      "overlay": "rgba(216, 188, 65, 0.9)",
      "text": "#ffffff"
    }
  },
  "typography": {
    "fontFamily": {
      "sans": ["Heebo", "ui-sans-serif", "system-ui", "-apple-system", "sans-serif"],
      "serif": ["Raleway", "ui-serif", "Georgia", "serif"],
      "mono": ["ui-monospace", "SFMono-Regular", "monospace"]
    },
    "fontSize": {
      "xs": "0.75rem",
      "sm": "0.875rem",
      "base": "1rem",
      "lg": "1.125rem",
      "xl": "1.25rem",
      "2xl": "1.5rem",
      "3xl": "1.875rem",
      "4xl": "2.25rem",
      "5xl": "3rem",
      "6xl": "3.75rem",
      "7xl": "4.5rem",
      "8xl": "5.5rem"
    },
    "fontWeight": {
      "light": 300,
      "normal": 400,
      "medium": 500,
      "semibold": 600,
      "bold": 700,
      "extrabold": 800
    },
    "lineHeight": {
      "tight": "1.25",
      "normal": "1.5",
      "relaxed": "1.75",
      "loose": "2"
    }
  },
  "spacing": {
    "xs": "0.25rem",
    "sm": "0.5rem",
    "md": "1rem",
    "lg": "1.5rem",
    "xl": "2rem",
    "2xl": "3rem",
    "3xl": "4rem",
    "4xl": "6rem",
    "5xl": "8rem",
    "6xl": "10rem"
  },
  "borderRadius": {
    "none": "0",
    "sm": "0.25rem",
    "md": "0.5rem",
    "lg": "0.75rem",
    "xl": "1rem",
    "2xl": "1.25rem",
    "3xl": "1.75rem",
    "full": "9999px",
    "hero": "24px"
  },
  "shadows": {
    "sm": "0 2px 4px 0 rgb(0 0 0 / 0.06)",
    "md": "0 4px 8px -1px rgb(0 0 0 / 0.12), 0 2px 4px -2px rgb(0 0 0 / 0.08)",
    "lg": "0 10px 20px -3px rgb(0 0 0 / 0.15), 0 4px 8px -4px rgb(0 0 0 / 0.1)",
    "xl": "0 20px 30px -5px rgb(0 0 0 / 0.18), 0 8px 16px -6px rgb(0 0 0 / 0.12)",
    "2xl": "0 25px 50px -12px rgb(0 0 0 / 0.25)",
    "inner": "inset 0 2px 4px 0 rgb(0 0 0 / 0.06)",
    "fresh": "0 8px 25px rgba(216, 188, 65, 0.2)"
  },
  "breakpoints": {
    "sm": "640px",
    "md": "768px",
    "lg": "1024px",
    "xl": "1280px",
    "2xl": "1536px",
    "3xl": "1650px"
  },
  "animation": {
    "transition": {
      "fast": "150ms",
      "normal": "250ms",
      "slow": "350ms",
      "fresh": "300ms"
    },
    "easing": {
      "linear": "linear",
      "out": "cubic-bezier(0, 0, 0.2, 1)",
      "in": "cubic-bezier(0.4, 0, 1, 1)",
      "inOut": "cubic-bezier(0.4, 0, 0.2, 1)",
      "fresh": "cubic-bezier(0.25, 0.1, 0.25, 1)"
    }
  },
  "components": {
    "navbar": {
      "height": "4.5rem",
      "padding": "1rem 2rem",
      "background": "rgba(255, 255, 255, 0.95)",
      "backdropBlur": "blur(16px)",
      "borderBottom": "1px solid rgba(216, 188, 65, 0.2)"
    },
    "hero": {
      "minHeight": "70vh",
      "padding": "4rem 2rem",
      "titleSize": "3.5rem",
      "subtitleSize": "1.375rem",
      "background": "linear-gradient(135deg, #d8bc41 0%, #ff6a6a 100%)"
    },
    "card": {
      "padding": "2.5rem",
      "borderRadius": "1rem",
      "background": "#ffffff",
      "shadow": "0 8px 25px rgba(216, 188, 65, 0.2)"
    },
    "button": {
      "padding": "0.875rem 2.5rem",
      "borderRadius": "0.75rem",
      "fontWeight": 600,
      "transition": "all 300ms cubic-bezier(0.25, 0.1, 0.25, 1)"
    },
    "menu": {
      "itemPadding": "2rem",
      "imageSize": "120px",
      "borderRadius": "1rem"
    }
  }
}