{
  "$schema": "../../src/schema/skin-tokens.schema.json",
  "meta": {
    "name": "Bistly Modern",
    "description": "Authentic Bistly restaurant design with elegant golden accents and dark sophisticated styling",
    "version": "1.0.0",
    "author": "Component Kit System",
    "tags": ["premium", "authentic", "bistly", "modern", "restaurant", "elegant"],
    "preview": "preview.jpg",
    "created": "2025-08-12T00:00:00Z",
    "updated": "2025-08-12T00:00:00Z"
  },
  "colors": {
    "primary": "#D0965C",
    "primaryHover": "#B8824A",
    "secondary": "#2D4443",
    "accent": "#FF9F1A",
    "background": "#ffffff",
    "surface": "#FBFBFB",
    "dark": "#2D4443",
    "text": {
      "primary": "#2D4443",
      "secondary": "#5C5C5C",
      "muted": "#8A8A8A",
      "inverse": "#ffffff",
      "accent": "#D0965C"
    },
    "border": {
      "default": "#E9E9E9",
      "light": "#F7F7F7",
      "dark": "#2D4443",
      "accent": "#D0965C"
    },
    "status": {
      "success": "#10b981",
      "warning": "#FF9F1A",
      "error": "#ef4444",
      "info": "#2D4443"
    },
    "hero": {
      "background": "#2D4443",
      "overlay": "rgba(45, 68, 67, 0.85)",
      "text": "#ffffff"
    }
  },
  "typography": {
    "fontFamily": {
      "sans": ["Roboto", "ui-sans-serif", "system-ui", "-apple-system", "sans-serif"],
      "serif": ["Marcellus", "ui-serif", "Georgia", "serif"],
      "mono": ["ui-monospace", "SFMono-Regular", "monospace"]
    },
    "fontSize": {
      "xs": "0.75rem",
      "sm": "0.875rem",
      "base": "1rem",
      "lg": "1.125rem",
      "xl": "1.25rem",
      "2xl": "1.5rem",
      "3xl": "1.875rem",
      "4xl": "2.25rem",
      "5xl": "3rem",
      "6xl": "3.75rem",
      "7xl": "4.5rem",
      "8xl": "5.3rem"
    },
    "fontWeight": {
      "light": 300,
      "normal": 400,
      "medium": 500,
      "semibold": 600,
      "bold": 700,
      "extrabold": 800
    },
    "lineHeight": {
      "tight": "1.25",
      "normal": "1.5",
      "relaxed": "1.75",
      "loose": "2"
    }
  },
  "spacing": {
    "xs": "0.25rem",
    "sm": "0.5rem",
    "md": "1rem",
    "lg": "1.5rem",
    "xl": "2rem",
    "2xl": "3rem",
    "3xl": "4rem",
    "4xl": "6rem",
    "5xl": "8rem",
    "6xl": "10rem"
  },
  "borderRadius": {
    "none": "0",
    "sm": "0.125rem",
    "md": "0.375rem",
    "lg": "0.5rem",
    "xl": "0.75rem",
    "2xl": "1rem",
    "3xl": "1.5rem",
    "full": "9999px",
    "hero": "400px"
  },
  "shadows": {
    "sm": "0 1px 2px 0 rgb(0 0 0 / 0.05)",
    "md": "0 4px 6px -1px rgb(0 0 0 / 0.1), 0 2px 4px -2px rgb(0 0 0 / 0.1)",
    "lg": "0 10px 15px -3px rgb(0 0 0 / 0.1), 0 4px 6px -4px rgb(0 0 0 / 0.1)",
    "xl": "0 20px 25px -5px rgb(0 0 0 / 0.1), 0 8px 10px -6px rgb(0 0 0 / 0.1)",
    "2xl": "0 25px 50px -12px rgb(0 0 0 / 0.25)",
    "inner": "inset 0 2px 4px 0 rgb(0 0 0 / 0.06)",
    "elegant": "0 8px 25px rgba(45, 68, 67, 0.15)"
  },
  "breakpoints": {
    "sm": "640px",
    "md": "768px",
    "lg": "1024px",
    "xl": "1280px",
    "2xl": "1536px",
    "3xl": "1650px"
  },
  "animation": {
    "transition": {
      "fast": "150ms",
      "normal": "200ms",
      "slow": "300ms",
      "elegant": "400ms"
    },
    "easing": {
      "linear": "linear",
      "out": "cubic-bezier(0, 0, 0.2, 1)",
      "in": "cubic-bezier(0.4, 0, 1, 1)",
      "inOut": "cubic-bezier(0.4, 0, 0.2, 1)",
      "elegant": "cubic-bezier(0.25, 0.46, 0.45, 0.94)"
    }
  },
  "components": {
    "navbar": {
      "height": "4rem",
      "padding": "1rem 1.5rem",
      "background": "rgba(255, 255, 255, 0.95)",
      "backdropBlur": "blur(12px)",
      "borderBottom": "1px solid #e2e8f0"
    },
    "hero": {
      "minHeight": "60vh",
      "padding": "3rem 1.5rem",
      "titleSize": "3rem",
      "subtitleSize": "1.25rem",
      "background": "#2D4443"
    },
    "card": {
      "padding": "2rem",
      "borderRadius": "0.5rem",
      "background": "#ffffff",
      "shadow": "0 8px 25px rgba(45, 68, 67, 0.15)"
    },
    "button": {
      "padding": "0.75rem 2rem",
      "borderRadius": "0.5rem",
      "fontWeight": 600,
      "transition": "all 300ms cubic-bezier(0.25, 0.46, 0.45, 0.94)"
    },
    "menu": {
      "itemPadding": "1.5rem",
      "imageSize": "100px",
      "borderRadius": "0.5rem"
    }
  }
}