{
  "$schema": "../../src/schema/skin-tokens.schema.json",
  "meta": {
    "name": "Conbiz Premium",
    "description": "Professional business theme with bright yellow/gold primary and green secondary colors, featuring Epilogue typography",
    "version": "1.0.0",
    "author": "Component Kit System",
    "tags": ["premium", "business", "professional", "corporate", "modern"],
    "preview": "preview.jpg",
    "created": "2025-08-12T12:00:00Z",
    "updated": "2025-08-12T12:00:00Z"
  },
  "colors": {
    "primary": "#ffc53c",
    "primaryHover": "#e6b135",
    "secondary": "#008136",
    "accent": "#fff8e1",
    "background": "#ffffff",
    "surface": "#fafafa",
    "text": {
      "primary": "#1a1a1a",
      "secondary": "#4a4a4a",
      "muted": "#6b7280",
      "inverse": "#ffffff"
    },
    "border": {
      "default": "#e5e7eb",
      "light": "#f3f4f6",
      "dark": "#d1d5db"
    },
    "status": {
      "success": "#008136",
      "warning": "#ffc53c",
      "error": "#dc2626",
      "info": "#3b82f6"
    }
  },
  "typography": {
    "fontFamily": {
      "sans": ["Epilogue", "ui-sans-serif", "system-ui", "-apple-system", "sans-serif"],
      "serif": ["Epilogue", "ui-serif", "Georgia", "serif"],
      "mono": ["ui-monospace", "SFMono-Regular", "monospace"]
    },
    "fontSize": {
      "xs": "0.75rem",
      "sm": "0.875rem",
      "base": "1rem",
      "lg": "1.125rem",
      "xl": "1.25rem",
      "2xl": "1.5rem",
      "3xl": "1.875rem",
      "4xl": "2.25rem",
      "5xl": "3rem",
      "6xl": "3.75rem"
    },
    "fontWeight": {
      "light": 300,
      "normal": 400,
      "medium": 500,
      "semibold": 600,
      "bold": 700,
      "extrabold": 800
    },
    "lineHeight": {
      "tight": "1.25",
      "normal": "1.5",
      "relaxed": "1.75"
    }
  },
  "spacing": {
    "xs": "0.25rem",
    "sm": "0.5rem",
    "md": "1rem",
    "lg": "1.5rem",
    "xl": "2rem",
    "2xl": "3rem",
    "3xl": "4rem",
    "4xl": "6rem",
    "5xl": "8rem"
  },
  "borderRadius": {
    "none": "0",
    "sm": "0.125rem",
    "md": "0.375rem",
    "lg": "0.5rem",
    "xl": "0.75rem",
    "2xl": "1rem",
    "full": "9999px"
  },
  "shadows": {
    "sm": "0 1px 2px 0 rgb(0 0 0 / 0.05)",
    "md": "0 4px 6px -1px rgb(0 0 0 / 0.1), 0 2px 4px -2px rgb(0 0 0 / 0.1)",
    "lg": "0 10px 15px -3px rgb(0 0 0 / 0.1), 0 4px 6px -4px rgb(0 0 0 / 0.1)",
    "xl": "0 20px 25px -5px rgb(0 0 0 / 0.1), 0 8px 10px -6px rgb(0 0 0 / 0.1)",
    "2xl": "0 25px 50px -12px rgb(0 0 0 / 0.25)",
    "inner": "inset 0 2px 4px 0 rgb(0 0 0 / 0.06)"
  },
  "breakpoints": {
    "sm": "640px",
    "md": "768px",
    "lg": "1024px",
    "xl": "1280px",
    "2xl": "1536px"
  },
  "animation": {
    "transition": {
      "fast": "150ms",
      "normal": "200ms",
      "slow": "300ms"
    },
    "easing": {
      "linear": "linear",
      "out": "cubic-bezier(0, 0, 0.2, 1)",
      "in": "cubic-bezier(0.4, 0, 1, 1)",
      "inOut": "cubic-bezier(0.4, 0, 0.2, 1)"
    }
  },
  "components": {
    "navbar": {
      "height": "4rem",
      "padding": "1rem 1.5rem",
      "background": "rgba(255, 255, 255, 0.95)",
      "backdropBlur": "blur(12px)",
      "borderBottom": "1px solid #e5e7eb"
    },
    "hero": {
      "minHeight": "65vh",
      "padding": "3rem 1.5rem",
      "titleSize": "3rem",
      "subtitleSize": "1.25rem"
    },
    "card": {
      "padding": "1.5rem",
      "borderRadius": "0.5rem",
      "background": "#ffffff",
      "shadow": "0 4px 6px -1px rgb(0 0 0 / 0.1)"
    },
    "button": {
      "padding": "0.75rem 1.5rem",
      "borderRadius": "0.5rem",
      "fontWeight": 600,
      "transition": "all 200ms cubic-bezier(0.4, 0, 0.2, 1)"
    }
  }
}