{
  "$schema": "../../src/schema/skin-tokens.schema.json",
  "meta": {
    "name": "Foodera Modern",
    "description": "Professional food and restaurant template with modern design inspired by Foodera",
    "version": "1.0.0",
    "author": "Claude Code",
    "tags": ["foodera", "modern", "restaurant", "professional"],
    "preview": "preview.jpg",
    "created": "2025-01-14T00:00:00Z",
    "updated": "2025-01-14T00:00:00Z"
  },
  "colors": {
    "primary": "#e74c3c",
    "primaryHover": "#c0392b",
    "secondary": "#43121d",
    "accent": "#f39c12",
    "background": "#ffffff",
    "surface": "#f8f9fa",
    "text": {
      "primary": "#43121d",
      "secondary": "#555555",
      "muted": "#999999",
      "inverse": "#ffffff"
    },
    "border": {
      "default": "#e9ecef",
      "light": "#f1f3f4",
      "dark": "#dee2e6"
    },
    "status": {
      "success": "#27ae60",
      "warning": "#f39c12",
      "error": "#e74c3c",
      "info": "#3498db"
    }
  },
  "typography": {
    "fontFamily": {
      "sans": ["Roboto", "ui-sans-serif", "system-ui", "-apple-system", "sans-serif"],
      "serif": ["Quicksand", "ui-serif", "Georgia", "serif"],
      "mono": ["ui-monospace", "SFMono-Regular", "monospace"]
    },
    "fontSize": {
      "xs": "0.75rem",
      "sm": "0.875rem",
      "base": "1rem",
      "lg": "1.125rem",
      "xl": "1.25rem",
      "2xl": "1.5rem",
      "3xl": "1.875rem",
      "4xl": "2.25rem",
      "5xl": "3rem",
      "6xl": "3.75rem"
    },
    "fontWeight": {
      "light": 300,
      "normal": 400,
      "medium": 500,
      "semibold": 600,
      "bold": 700,
      "extrabold": 800
    },
    "lineHeight": {
      "tight": "1.25",
      "normal": "1.5",
      "relaxed": "1.75"
    }
  },
  "spacing": {
    "xs": "0.25rem",
    "sm": "0.5rem", 
    "md": "1rem",
    "lg": "1.5rem",
    "xl": "2rem",
    "2xl": "3rem",
    "3xl": "4rem"
  },
  "borderRadius": {
    "none": "0",
    "sm": "0.125rem",
    "md": "0.375rem",
    "lg": "0.5rem",
    "xl": "0.75rem",
    "2xl": "1rem",
    "full": "9999px"
  },
  "shadows": {
    "sm": "0 1px 2px 0 rgba(0, 0, 0, 0.05)",
    "md": "0 4px 6px -1px rgba(0, 0, 0, 0.1)",
    "lg": "0 10px 15px -3px rgba(0, 0, 0, 0.1)",
    "xl": "0 20px 25px -5px rgba(0, 0, 0, 0.1)"
  },
  "breakpoints": {
    "sm": "640px",
    "md": "768px", 
    "lg": "1024px",
    "xl": "1280px",
    "2xl": "1536px"
  },
  "animation": {
    "transition": {
      "fast": "150ms",
      "normal": "200ms",
      "slow": "300ms"
    },
    "easing": {
      "linear": "linear",
      "out": "cubic-bezier(0, 0, 0.2, 1)",
      "in": "cubic-bezier(0.4, 0, 1, 1)",
      "inOut": "cubic-bezier(0.4, 0, 0.2, 1)"
    }
  },
  "components": {
    "navbar": {
      "height": "4.375rem",
      "padding": "1rem 1.5rem",
      "background": "rgba(255, 255, 255, 0.95)",
      "backdropBlur": "blur(12px)",
      "borderBottom": "1px solid #e2e8f0"
    },
    "hero": {
      "minHeight": "60vh",
      "padding": "5rem 1.5rem",
      "titleSize": "3rem",
      "subtitleSize": "1.25rem"
    },
    "card": {
      "padding": "1.5rem",
      "borderRadius": "0.5rem",
      "background": "#ffffff",
      "shadow": "0 4px 6px -1px rgb(0 0 0 / 0.1)"
    },
    "button": {
      "padding": "0.75rem 1.5rem",
      "borderRadius": "0.5rem",
      "fontWeight": 600,
      "transition": "all 200ms cubic-bezier(0.4, 0, 0.2, 1)"
    }
  }
}